{
  "schema_version": 1,
  "identity": {
    "id": "projects-v3-universal-card",
    "capability_name": "Universal plain-language work card + project lifecycle (funnel -> pipeline -> brainstorm -> spec -> build -> closeout)",
    "north_star_ref": "docs/projects-tab-v3-north-star.md §8 (reuse / shelf descriptor — the durability mandate)",
    "source_repos": [
      "ourliberty-agent-core (authoring: Narrator/closeout/brainstorm authors, projects_store model, trust_policy, dashboard_api card-chat backend)",
      "ourliberty-dashboard (rendering: the funnel card + meaning layer + lane adapters)"
    ],
    "consumers": [
      "Missions/Projects tab (first consumer — the surface the capability was authored on)",
      "Approvals tab (first NEW adopter — projects-v3 P7, the proof that the capability generalizes)",
      "Operations / Alerts tabs (intended later adopters once they have a first-class decision-item model)",
      "Future products (e.g. RSDPM) that need a plain-language work pipeline"
    ]
  },
  "capability_statement": "One reusable process that turns any unit of work into a plain-English card a non-engineer can act on, and (for committed work) into a project that flows through a visible lifecycle. The FUNNEL side renders everything not yet committed (parked items, team suggestions, leftover orphans) as a single card that says, in the operator's terms, what it is / why it matters / how careful to be / what we suggest, with a one-click action set whose clicks dispatch REAL work rather than minting inert records. The PIPELINE side renders committed work as Projects, each a North-Star reference plus an ordered list of Phases moving Brainstorm -> Spec -> Building -> Done (a one-off is a single-phase project, no ceremony). Entering BRAINSTORM, a phase arrives pre-filled with an AI draft + a capped list of the genuine operator decisions + a deterministic handoff payload. SPEC and BUILD ride the existing dispatch/approval/DAG machinery. On verified merge, a dedicated CLOSEOUT pass authors a plain-language summary back onto the card (what shipped, what changed vs spec, learnings, cost, done-gate met) and can spawn bounded follow-ups back into the funnel — so the next phase always opens with context and the board is never stale. The whole thing speaks one plain-language grammar (absence renders as neutral, never raw machine fields) and surfaces a read-only risk/autonomy disposition off the trust policy so the dial is visible before it ever acts.",
  "contracts": [
    {
      "name": "normalized card view-model (FunnelItem)",
      "kind": "data-shape",
      "description": "Every lane/surface normalizes its own wire type into ONE FunnelItem view-model (id, source, title, last_touched, label, status_badge, aging, pr_url, briefing/risk/risk_note/recommended_action). The card never sees a raw lane/surface type. A new surface plugs in by writing one adapter to this shape; the card stays surface-agnostic.",
      "generic_or_surface_specific": "generic"
    },
    {
      "name": "source -> FunnelItem adapter",
      "kind": "adapter",
      "description": "Per-source pure function (parkedToFunnelItem / suggestedToFunnelItem / orphanToFunnelItem today; approvalToFunnelItem next) that maps a surface's wire object into the normalized card shape. This is the surface seam — the adapter + the action set carry the per-surface difference; the card learns nothing about the surface.",
      "generic_or_surface_specific": "surface-specific"
    },
    {
      "name": "pluggable action set",
      "kind": "action-set",
      "description": "The card takes an action-set descriptor as a slot/prop (funnel: Delegate/Snooze/Drop/Talk/Promote; approvals: Approve/Reject/Comment/Mark-done). Actions dispatch real work through the surface's own action endpoint. The card does NOT branch internally per surface; surface differences live in the action set, not in the card.",
      "generic_or_surface_specific": "surface-specific"
    },
    {
      "name": "meaning-layer briefing (what/why/suggest + risk dial)",
      "kind": "ui-grammar",
      "description": "Plain-language briefing + risk badge + risk note, namespace+id parameterized so testids stay surface-scoped. Absence renders as NEUTRAL (no Narrator briefing => show the request text + a neutral state, never garbage or raw metadata). Every surface keeps this same grammar (North Star §4.10): no raw machine fields, absence is legal, no bare accept/dismiss.",
      "generic_or_surface_specific": "generic"
    },
    {
      "name": "card-chat (Talk-to-team) backend",
      "kind": "data-shape",
      "description": "dashboard_api._CARD_KIND_META keys chat on a generic kind (id_key, noun, thread_url) over _post_card_message / _card_thread_messages. Adding a surface's chat is one meta entry + two thin find/404 routes (the P6.1 'phase' kind is the precedent). Optional per surface — only needed when two-way conversation on items is wanted.",
      "generic_or_surface_specific": "generic"
    },
    {
      "name": "project + phase lifecycle model",
      "kind": "data-shape",
      "description": "projects_store defines the registry: a Project = North-Star ref + ordered Phases; a Phase has a Desired End State, a lifecycle_state (brainstorm/spec/building/done), and optional spec_ref/sequence_ref. Legal transitions are forward-by-one, any-backward, or no-op — never a skip. Reusable as the file-backed pipeline model for any agent-OS surface or product.",
      "generic_or_surface_specific": "generic"
    },
    {
      "name": "closeout trigger + schema",
      "kind": "event-trigger",
      "description": "On SEQUENCE_COMPLETE (a phase reaching Done) the closeout author runs ONCE, gathers the merged diff + PR bodies/commits + spec + North Star, and writes the structured closeout (shipped / changed_vs_spec / learnings / cost / done_gate_met) onto the card; it can drop bounded, deduped follow-ups into the funnel. Event-driven, never a clock.",
      "generic_or_surface_specific": "generic"
    },
    {
      "name": "authoring-vs-render split",
      "kind": "authoring-render-split",
      "description": "All plain-language authoring (briefings, brainstorm drafts, closeouts) happens agent-side via the Narrator family with a deterministic fallback (the LLM is never load-bearing); the dashboard only RENDERS. A new surface reuses the authoring family and supplies what context the Narrator reads — it does not build a second authoring engine.",
      "generic_or_surface_specific": "generic"
    },
    {
      "name": "read-only autonomy disposition",
      "kind": "data-shape",
      "description": "Each card exposes a risk-derived disposition ('would auto-pass at the loose setting' / 'always needs you') read off trust_policy (config/trust-policy.json, re-read every call) and the Narrator's safe/medium/careful mapping. Read-only in this cut: it shows the dial before it ever acts; no write path, no policy mutation from the card.",
      "generic_or_surface_specific": "generic"
    }
  ],
  "reuse_mode": {
    "mode": "assembly-of-shelf-components",
    "rationale": "Most of the spine is already generic and catalogued: the meaning layer (BriefingBlock/RiskBadge/RiskNote) is namespace-parameterized, the clarify drawer/reply box are pure and label-overridable (and the reply box already lives under app/approvals/components/), the capture action bar is action-agnostic, the card-chat backend is already kind-generic, and trust_policy already evaluates the autonomy dial. A new surface is therefore ASSEMBLY: write one source->FunnelItem adapter + one action-set descriptor (+ optionally one _CARD_KIND_META entry for chat) and reuse everything else. The only greenfield in P7 was THIS descriptor; adopting the capability on a new surface is not a rebuild."
  },
  "reuse_boundary": {
    "generic": [
      "The universal card itself (layout + the meaning-layer briefing: what/why/suggest + risk dial) — same on every surface, namespace+id parameterized so testids stay scoped.",
      "The Narrator authoring family (briefings, brainstorm pre-fill, closeout) with its deterministic fallback — one voice/model, reused, never re-implemented per surface.",
      "The risk/autonomy disposition off trust_policy (read-only) — same evaluator and same safe/medium/careful mapping everywhere.",
      "The card-chat / Talk-to-team backend (_CARD_KIND_META over _post_card_message / _card_thread_messages) — kind-generic, one meta entry per new surface.",
      "The doorbell pattern (Telegram is just a notifier; the dashboard is the act-on surface and stays a non-committer).",
      "The project/phase lifecycle model (projects_store) — Brainstorm->Spec->Building->Done, forward/backward/no-op transitions, single-phase one-offs.",
      "The closeout pass (event-driven, structured schema, feeds-forward, bounded follow-ups).",
      "The brainstorm template + auto-fill (the 8-section draft + capped 'Your decisions' + deterministic handoff payload)."
    ],
    "surface_specific": [
      "WHICH REGISTRY the items live in (parked/suggested/orphan captures for the funnel; the approvals pending bucket for Approvals; each future tab's own item model).",
      "THE AVAILABLE ACTIONS (the action-set descriptor: Delegate/Snooze/Drop/Talk/Promote for the funnel vs Approve/Reject/Comment/Mark-done for Approvals), including any event-type-gated affordances that should stay surface-local rather than bloat the generic card.",
      "THE CONTEXT THE NARRATOR READS to author the briefing for that surface (a capture's fields vs an approval request's prompt/question/message); risk/recommended_action stay optional and absence renders neutral."
    ]
  },
  "seams": [
    "source -> FunnelItem adapter seam (dashboard lib/funnel.ts): each lane/surface goes through an adapter into the ONE FunnelItem shape; the card never touches a raw wire type — this is the seam a new surface plugs into (mirrors the funnel component card's adapter seam).",